<?xml version="1.0" encoding="UTF-8"?>
<Dataset name="dap-3.3-test.1.xml" dapVersion="3.3" xmlns="http://xml.opendap.org/ns/DAP/3.3#"
    xmlns:xsi="http://www.w3.org/2001/XMLSchema-instance"
    xsi:schemaLocation="http://xml.opendap.org/ns/DAP/3.3# 
    file:/Users/jimg/xml/dap/dap3.3.1.xsd">
    <AnyXML name="info" unique="Huh">
        <comment>This is a test DDX for the DAP 3.3 schema.</comment>
    </AnyXML>
    <Group>

        <Grid name="SST">
            <Map name="longitude" type="Float32">
                <dimension size="1024"/>
            </Map>
            <Map name="latitude" type="Float32">
                <dimension size="1024"/>
            </Map>

            <Array name="SST">
                <template>
                    <Byte/>
                </template>
                <dimension name="longitude"/>
                <dimension name="latitude"/>
            </Array>
        </Grid>

    </Group>

    <Group name="Masks">

        <Grid name="Land">
            <Map name="longitude" type="Float32">
                <dimension size="512"/>
            </Map>
            <Map name="latitude" type="Float32">
                <dimension size="512"/>
            </Map>

            <Array name="Land">
                <template>
                    <Byte/>
                </template>
                <dimension name="longitude"/>
                <dimension name="latitude"/>
            </Array>
        </Grid>

    </Group>

</Dataset>
